{
  "purpose": "顧客へ作業の現状を伝え、次の対応への了解を得る",
  "audience": "継続的に取引している法人顧客のIT担当者",
  "action_expected": true,
  "constraints": [
    "日本語の丁寧なメール。必要事項を簡潔に伝える",
    "確認済みの事実と未確定事項を分ける"
  ],
  "source_facts": [
    "切り替え用ライセンスキーの一部がまだ未着",
    "必要なキーが揃い次第、訪問日程を調整する",
    "初回の対象はA店舗。訪問日は未確定"
  ],
  "required_information": [
    "一部キーが未着であること",
    "揃い次第、日程調整すること",
    "初回対象はA店舗であること"
  ],
  "protected_fragments": [
    "A店舗"
  ],
  "style_reference": "簡潔で具体的。状況と次のアクションを先に述べる。",
  "locked_sections": []
}
